{"schema":1,"abi":{"target":"aarch64","os":"macos","environment":"none","pointer_size":8,"usize_size":8,"max_alignment":8,"endian":"little"},"library_version":"0.1.0-dev","commit":null,"dirty":null,"types":{"GhosttyAllocator":{"kind":"struct","size":16,"align":8,"fields":{"ctx":{"offset":0,"size":8,"type":"pointer","elem":"opaque","const":false},"vtable":{"offset":8,"size":8,"type":"pointer","elem":"GhosttyAllocatorVtable","const":true}}},"GhosttyAllocatorVtable":{"kind":"struct","size":32,"align":8,"fields":{"alloc":{"offset":0,"size":8,"type":"pointer","elem":"function","const":true},"resize":{"offset":8,"size":8,"type":"pointer","elem":"function","const":true},"remap":{"offset":16,"size":8,"type":"pointer","elem":"function","const":true},"free":{"offset":24,"size":8,"type":"pointer","elem":"function","const":true}}},"GhosttyBuffer":{"kind":"struct","size":24,"align":8,"fields":{"ptr":{"offset":0,"size":8,"type":"pointer","elem":"u8","const":false,"nullable":true},"cap":{"offset":8,"size":8,"type":"u64"},"len":{"offset":16,"size":8,"type":"u64"}}},"GhosttyCellsView":{"kind":"struct","size":16,"align":8,"fields":{"ptr":{"offset":0,"size":8,"type":"pointer","elem":"GhosttyCell","const":true,"nullable":true},"len":{"offset":8,"size":8,"type":"u64"}}},"GhosttyClipboardContent":{"kind":"struct","size":32,"align":8,"fields":{"mime":{"offset":0,"size":16,"type":"GhosttyString"},"data":{"offset":16,"size":16,"type":"GhosttyString"}}},"GhosttyClipboardWrite":{"kind":"struct","size":32,"align":8,"fields":{"size":{"offset":0,"size":8,"type":"u64"},"location":{"offset":8,"size":4,"type":"GhosttyClipboardLocation"},"contents":{"offset":16,"size":8,"type":"pointer","elem":"GhosttyClipboardContent","const":true,"nullable":true},"contents_len":{"offset":24,"size":8,"type":"u64"}}},"GhosttyCodepoints":{"kind":"struct","size":16,"align":8,"fields":{"ptr":{"offset":0,"size":8,"type":"pointer","elem":"u32","const":true,"nullable":true},"len":{"offset":8,"size":8,"type":"u64"}}},"GhosttyColorPaletteMask":{"kind":"struct","size":32,"align":8,"fields":{"bits":{"offset":0,"size":32,"type":"array","elem":"u64","count":4}}},"GhosttyColorRgb":{"kind":"struct","size":3,"align":1,"fields":{"r":{"offset":0,"size":1,"type":"u8"},"g":{"offset":1,"size":1,"type":"u8"},"b":{"offset":2,"size":1,"type":"u8"}}},"GhosttyColorX11Entry":{"kind":"struct","size":16,"align":8,"fields":{"name":{"offset":0,"size":8,"type":"pointer","elem":"u8","const":true,"nullable":true},"color":{"offset":8,"size":3,"type":"GhosttyColorRgb"}}},"GhosttyDeviceAttributes":{"kind":"struct","size":160,"align":8,"fields":{"primary":{"offset":0,"size":144,"type":"GhosttyDeviceAttributesPrimary"},"secondary":{"offset":144,"size":6,"type":"GhosttyDeviceAttributesSecondary"},"tertiary":{"offset":152,"size":4,"type":"GhosttyDeviceAttributesTertiary"}}},"GhosttyDeviceAttributesPrimary":{"kind":"struct","size":144,"align":8,"fields":{"conformance_level":{"offset":0,"size":2,"type":"u16"},"features":{"offset":2,"size":128,"type":"array","elem":"u16","count":64},"num_features":{"offset":136,"size":8,"type":"u64"}}},"GhosttyDeviceAttributesSecondary":{"kind":"struct","size":6,"align":2,"fields":{"device_type":{"offset":0,"size":2,"type":"u16"},"firmware_version":{"offset":2,"size":2,"type":"u16"},"rom_cartridge":{"offset":4,"size":2,"type":"u16"}}},"GhosttyDeviceAttributesTertiary":{"kind":"struct","size":4,"align":4,"fields":{"unit_id":{"offset":0,"size":4,"type":"u32"}}},"GhosttyFormatterScreenExtra":{"kind":"struct","size":16,"align":8,"fields":{"size":{"offset":0,"size":8,"type":"u64"},"cursor":{"offset":8,"size":1,"type":"bool"},"style":{"offset":9,"size":1,"type":"bool"},"hyperlink":{"offset":10,"size":1,"type":"bool"},"protection":{"offset":11,"size":1,"type":"bool"},"kitty_keyboard":{"offset":12,"size":1,"type":"bool"},"charsets":{"offset":13,"size":1,"type":"bool"}}},"GhosttyFormatterTerminalExtra":{"kind":"struct","size":32,"align":8,"fields":{"size":{"offset":0,"size":8,"type":"u64"},"palette":{"offset":8,"size":1,"type":"bool"},"modes":{"offset":9,"size":1,"type":"bool"},"scrolling_region":{"offset":10,"size":1,"type":"bool"},"tabstops":{"offset":11,"size":1,"type":"bool"},"pwd":{"offset":12,"size":1,"type":"bool"},"keyboard":{"offset":13,"size":1,"type":"bool"},"screen":{"offset":16,"size":16,"type":"GhosttyFormatterScreenExtra"}}},"GhosttyFormatterTerminalOptions":{"kind":"struct","size":56,"align":8,"fields":{"size":{"offset":0,"size":8,"type":"u64"},"emit":{"offset":8,"size":4,"type":"GhosttyFormatterFormat"},"unwrap":{"offset":12,"size":1,"type":"bool"},"trim":{"offset":13,"size":1,"type":"bool"},"extra":{"offset":16,"size":32,"type":"GhosttyFormatterTerminalExtra"},"selection":{"offset":48,"size":8,"type":"pointer","elem":"GhosttySelection","const":true,"nullable":true}}},"GhosttyGridRef":{"kind":"struct","size":24,"align":8,"fields":{"size":{"offset":0,"size":8,"type":"u64"},"node":{"offset":8,"size":8,"type":"pointer","elem":"opaque","const":false,"nullable":true},"x":{"offset":16,"size":2,"type":"u16"},"y":{"offset":18,"size":2,"type":"u16"}}},"GhosttyKittyGraphicsPlacementRenderInfo":{"kind":"struct","size":56,"align":8,"fields":{"size":{"offset":0,"size":8,"type":"u64"},"pixel_width":{"offset":8,"size":4,"type":"u32"},"pixel_height":{"offset":12,"size":4,"type":"u32"},"grid_cols":{"offset":16,"size":4,"type":"u32"},"grid_rows":{"offset":20,"size":4,"type":"u32"},"viewport_col":{"offset":24,"size":4,"type":"i32"},"viewport_row":{"offset":28,"size":4,"type":"i32"},"viewport_visible":{"offset":32,"size":1,"type":"bool"},"source_x":{"offset":36,"size":4,"type":"u32"},"source_y":{"offset":40,"size":4,"type":"u32"},"source_width":{"offset":44,"size":4,"type":"u32"},"source_height":{"offset":48,"size":4,"type":"u32"}}},"GhosttyMouseEncoderSize":{"kind":"struct","size":40,"align":8,"fields":{"size":{"offset":0,"size":8,"type":"u64"},"screen_width":{"offset":8,"size":4,"type":"u32"},"screen_height":{"offset":12,"size":4,"type":"u32"},"cell_width":{"offset":16,"size":4,"type":"u32"},"cell_height":{"offset":20,"size":4,"type":"u32"},"padding_top":{"offset":24,"size":4,"type":"u32"},"padding_bottom":{"offset":28,"size":4,"type":"u32"},"padding_right":{"offset":32,"size":4,"type":"u32"},"padding_left":{"offset":36,"size":4,"type":"u32"}}},"GhosttyMousePosition":{"kind":"struct","size":8,"align":4,"fields":{"x":{"offset":0,"size":4,"type":"f32"},"y":{"offset":4,"size":4,"type":"f32"}}},"GhosttyPoint":{"kind":"struct","size":24,"align":8,"fields":{"tag":{"offset":0,"size":4,"type":"GhosttyPointTag"},"value":{"offset":8,"size":16,"type":"GhosttyPointValue","tag":"tag","arms":{"ACTIVE":"coordinate","VIEWPORT":"coordinate","SCREEN":"coordinate","HISTORY":"coordinate"}}}},"GhosttyPointCoordinate":{"kind":"struct","size":8,"align":4,"fields":{"x":{"offset":0,"size":2,"type":"u16"},"y":{"offset":4,"size":4,"type":"u32"}}},"GhosttyPointValue":{"kind":"union","size":16,"align":8,"fields":{"coordinate":{"offset":0,"size":8,"type":"GhosttyPointCoordinate"},"_padding":{"offset":0,"size":16,"type":"array","elem":"u64","count":2}}},"GhosttyReader":{"kind":"struct","size":16,"align":8,"fields":{"read":{"offset":0,"size":8,"type":"pointer","elem":"function","const":true,"nullable":true},"userdata":{"offset":8,"size":8,"type":"pointer","elem":"opaque","const":false,"nullable":true}}},"GhosttyRenderStateColors":{"kind":"struct","size":792,"align":8,"fields":{"size":{"offset":0,"size":8,"type":"u64"},"background":{"offset":8,"size":3,"type":"GhosttyColorRgb"},"foreground":{"offset":11,"size":3,"type":"GhosttyColorRgb"},"cursor":{"offset":14,"size":3,"type":"GhosttyColorRgb"},"cursor_has_value":{"offset":17,"size":1,"type":"bool"},"palette":{"offset":18,"size":768,"type":"array","elem":"GhosttyColorRgb","count":256}}},"GhosttyRenderStateCursor":{"kind":"struct","size":24,"align":8,"fields":{"size":{"offset":0,"size":8,"type":"u64"},"viewport_has_value":{"offset":8,"size":1,"type":"bool"},"viewport_x":{"offset":10,"size":2,"type":"u16"},"viewport_y":{"offset":12,"size":2,"type":"u16"},"wide_tail":{"offset":14,"size":1,"type":"bool"},"visible":{"offset":15,"size":1,"type":"bool"},"blinking":{"offset":16,"size":1,"type":"bool"},"password_input":{"offset":17,"size":1,"type":"bool"},"visual_style":{"offset":20,"size":4,"type":"GhosttyRenderStateCursorVisualStyle"}}},"GhosttyRenderStateRowSelection":{"kind":"struct","size":16,"align":8,"fields":{"size":{"offset":0,"size":8,"type":"u64"},"start_x":{"offset":8,"size":2,"type":"u16"},"end_x":{"offset":10,"size":2,"type":"u16"}}},"GhosttySelection":{"kind":"struct","size":64,"align":8,"fields":{"size":{"offset":0,"size":8,"type":"u64"},"start":{"offset":8,"size":24,"type":"GhosttyGridRef"},"end":{"offset":32,"size":24,"type":"GhosttyGridRef"},"rectangle":{"offset":56,"size":1,"type":"bool"}}},"GhosttySelectionGestureBehaviors":{"kind":"struct","size":12,"align":4,"fields":{"single_click":{"offset":0,"size":4,"type":"GhosttySelectionGestureBehavior"},"double_click":{"offset":4,"size":4,"type":"GhosttySelectionGestureBehavior"},"triple_click":{"offset":8,"size":4,"type":"GhosttySelectionGestureBehavior"}}},"GhosttySelectionGestureGeometry":{"kind":"struct","size":16,"align":4,"fields":{"columns":{"offset":0,"size":4,"type":"u32"},"cell_width":{"offset":4,"size":4,"type":"u32"},"padding_left":{"offset":8,"size":4,"type":"u32"},"screen_height":{"offset":12,"size":4,"type":"u32"}}},"GhosttySgrAttribute":{"kind":"struct","size":72,"align":8,"fields":{"tag":{"offset":0,"size":4,"type":"GhosttySgrAttributeTag"},"value":{"offset":8,"size":64,"type":"GhosttySgrAttributeValue","tag":"tag","arms":{"UNSET":null,"UNKNOWN":"unknown","BOLD":null,"RESET_BOLD":null,"ITALIC":null,"RESET_ITALIC":null,"FAINT":null,"UNDERLINE":"underline","UNDERLINE_COLOR":"underline_color","UNDERLINE_COLOR_256":"underline_color_256","RESET_UNDERLINE_COLOR":null,"OVERLINE":null,"RESET_OVERLINE":null,"BLINK":null,"RESET_BLINK":null,"INVERSE":null,"RESET_INVERSE":null,"INVISIBLE":null,"RESET_